{
  "$schema": "http://json-schema.org/draft-07/schema#",
  "$id": "https://nidhinetra.local/contracts/normalized_record.schema.json",
  "title": "NormalizedRecord",
  "description": "Execution Plan section 3.1. Produced by A1 ingest+normalize. This is the single source of truth for the shape. Code generation is not wired (F-20): web/lib/types.ts mirrors it by hand, the Python code reads records as plain dicts, and pipeline/tests/test_contract_type_drift.py fails when the TypeScript mirror drifts.",
  "type": "object",
  "additionalProperties": false,
  "required": [
    "work_id",
    "state",
    "constituency",
    "mp_name",
    "tenure",
    "implementing_district_authority",
    "implementing_agency",
    "vendor_id",
    "vendor_name",
    "work_category",
    "work_description",
    "activity_name",
    "recommendation_date",
    "work_stage",
    "completion_date",
    "has_public_document",
    "sanctioned_amount_inr",
    "expenditure_amount_inr",
    "sanction_date",
    "completion_status",
    "last_updated",
    "source_rung"
  ],
  "properties": {
    "work_id": {
      "type": "string",
      "minLength": 1,
      "description": "Unique identifier for the work. Fatal if missing (eng review Success Criteria table)."
    },
    "state": {
      "type": "string",
      "minLength": 1,
      "description": "Fatal if missing: no peer group, no filtering."
    },
    "constituency": {
      "type": "string",
      "minLength": 1
    },
    "mp_name": {
      "type": "string",
      "minLength": 1
    },
    "tenure": {
      "type": "string",
      "pattern": "^[0-9]{4}-[0-9]{4}$",
      "description": "e.g. 2024-2029"
    },
    "implementing_district_authority": {
      "type": ["string", "null"],
      "description": "IDA_NAME from the Works Sanctioned tile: the Implementing District Authority that administers the work and owns the clause 4.5.2 annual inspection duty (MPLADS Guidelines 2023). The per-District-Authority quota and frozen district rank group by this field. Never used to fill implementing_agency (F-01, nemotronreview.md)."
    },
    "implementing_agency": {
      "type": ["string", "null"],
      "description": "IA_NAME from the Expenditure tile's payment events (the modal value per work, alphabetical tie-break): the Implementing Agency that executes the work. Null when the work has no payment event yet; never filled from implementing_district_authority (F-01). Degradable for the table, fatal for the fund-flow graph (M5)."
    },
    "vendor_id": {
      "type": [
        "string",
        "null"
      ],
      "minLength": 1,
      "description": "Stable source vendor identifier from the MPLADS expenditure tile. Null when the source provides no identifier; graph construction must never fall back to vendor_name as identity."
    },
    "vendor_name": {
      "type": ["string", "null"],
      "description": "Degradable for the table, fatal for the fund-flow graph (M5). Least likely field to be publicly exposed."
    },
    "work_category": {
      "type": "string",
      "enum": ["Road", "Drinking Water", "School", "Health", "Community Infrastructure", "Electricity", "Sanitation"],
      "description": "Fatal if missing: no category means no peer group, and peer group is mandatory on every flagged record."
    },
    "work_description": {
      "type": ["string", "null"],
      "description": "The recommendation's own free text from the Sanctioned tile (WORK_DESCRIPTION), spacing tidied and nothing else. Degradable: only the duplicate finder, the detail panel and the header search read it."
    },
    "activity_name": {
      "type": ["string", "null"],
      "description": "The portal's own activity string with its work-reference prefix stripped, one of 112 live values. Degradable: work_category stays the field every detector groups by."
    },
    "recommendation_date": {
      "type": ["string", "null"],
      "pattern": "^[0-9]{4}-[0-9]{2}-[0-9]{2}$",
      "description": "YYYY-MM-DD or null. The date the MP recommended the work, from RECOMMENDATION_DATE. Degradable: nothing scores on it yet."
    },
    "work_stage": {
      "type": ["string", "null"],
      "description": "The portal's own progress stage from the Sanctioned tile (WORK_STAGE), carried without interpretation. Six live values today: Sanction, Time Estimation, Vendor Identification, Physical Inspection, Work partially Completed, Work Completed. Degradable: completion_status stays the field every detector and filter uses; this is shown, never scored."
    },
    "completion_date": {
      "type": ["string", "null"],
      "pattern": "^[0-9]{4}-[0-9]{2}-[0-9]{2}$",
      "description": "YYYY-MM-DD or null. ACTUAL_END_DATE from the Completed tile's row with the same WORK_RECOMMENDATION_DTL_ID. Null for a work the Completed tile has no row for. Degradable: nothing scores on it yet."
    },
    "has_public_document": {
      "type": ["boolean", "null"],
      "description": "Whether the Sanctioned row's FILE_STATUS marks an attached document on the public portal. True when truthy, false when the key is present but falsy/None, null only when the key itself is absent from the row. Degradable: nothing scores on it yet."
    },
    "sanctioned_amount_inr": {
      "type": "number",
      "minimum": 0,
      "description": "Fatal if missing: the cost-outlier detector is the primary flag."
    },
    "expenditure_amount_inr": {
      "type": "number",
      "minimum": 0,
      "description": "Degradable: loses the expenditure-mismatch flag, keeps the rest."
    },
    "sanction_date": {
      "type": ["string", "null"],
      "pattern": "^[0-9]{4}-[0-9]{2}-[0-9]{2}$",
      "description": "YYYY-MM-DD or null. Degradable: needed for stalled-work detection."
    },
    "completion_status": {
      "type": "string",
      "enum": ["Recommended", "Sanctioned", "In Progress", "Completed"]
    },
    "last_updated": {
      "type": "string",
      "pattern": "^[0-9]{4}-[0-9]{2}-[0-9]{2}$"
    },
    "source_rung": {
      "type": "integer",
      "minimum": 1,
      "maximum": 5,
      "description": "Which acquisition rung produced this record. See Execution Plan section 2."
    }
  }
}
