[
  {
    "work_id": "MPLADS-FX-0001",
    "state": "Jharkhand",
    "constituency": "Jharkhand Constituency 4",
    "mp_name": "Rajesh Oraon",
    "tenure": "2024-2029",
    "implementing_district_authority": "Jharkhand District Authority",
    "implementing_agency": "Zilla Parishad Works Dept",
    "vendor_id": "SYNTH-V001",
    "vendor_name": "Rajdhani Civil Works",
    "work_category": "Drinking Water",
    "sanctioned_amount_inr": 3767224.6,
    "expenditure_amount_inr": 0.0,
    "sanction_date": null,
    "completion_status": "Recommended",
    "last_updated": "2026-08-15",
    "source_rung": 5,
    "work_description": "Construction of bore well near Zilla Parishad school, Ward 4",
    "activity_name": "Drinking water facilities",
    "recommendation_date": "2024-06-28",
    "work_stage": null,
    "completion_date": null,
    "has_public_document": null
  },
  {
    "work_id": "MPLADS-FX-0002",
    "state": "Madhya Pradesh",
    "constituency": "Madhya Pradesh Constituency 3",
    "mp_name": "Meena Kumari Singh",
    "tenure": "2024-2029",
    "implementing_district_authority": "Madhya Pradesh District Authority",
    "implementing_agency": "Municipal Corporation Works Cell",
    "vendor_id": "SYNTH-V002",
    "vendor_name": "Ganesh Infra Pvt Ltd",
    "work_category": "Road",
    "sanctioned_amount_inr": 2177947.3,
    "expenditure_amount_inr": 0.0,
    "sanction_date": null,
    "completion_status": "Recommended",
    "last_updated": "2026-08-15",
    "source_rung": 5,
    "work_description": "PCC road from Kisan Bhawan to the bus stop",
    "activity_name": "Construction of roads",
    "recommendation_date": "2024-07-02",
    "work_stage": null,
    "completion_date": null,
    "has_public_document": null
  },
  {
    "work_id": "MPLADS-FX-0003",
    "state": "Bihar",
    "constituency": "Bihar Constituency 19",
    "mp_name": "Anil Kumar Sharma",
    "tenure": "2024-2029",
    "implementing_district_authority": "Bihar District Authority",
    "implementing_agency": "Zilla Parishad Works Dept",
    "vendor_id": "SYNTH-V003",
    "vendor_name": "Shree Balaji Construction",
    "work_category": "Community Infrastructure",
    "sanctioned_amount_inr": 907588.04,
    "expenditure_amount_inr": 273106.92,
    "sanction_date": "2023-10-19",
    "completion_status": "Completed",
    "last_updated": "2026-08-15",
    "source_rung": 5,
    "work_description": "Installation of 5 solar street lights at the village chowk",
    "activity_name": "Street lighting",
    "recommendation_date": "2024-07-11",
    "work_stage": "Work Completed",
    "completion_date": "2024-09-05",
    "has_public_document": true
  },
  {
    "work_id": "MPLADS-FX-0004",
    "state": "Uttar Pradesh",
    "constituency": "Uttar Pradesh Constituency 18",
    "mp_name": "Rekha Devi Mahato",
    "tenure": "2024-2029",
    "implementing_district_authority": "Uttar Pradesh District Authority",
    "implementing_agency": "PWD Division 7",
    "vendor_id": "SYNTH-V003",
    "vendor_name": "Shree Balaji Construction",
    "work_category": "Road",
    "sanctioned_amount_inr": 3216456.95,
    "expenditure_amount_inr": 1534974.12,
    "sanction_date": "2023-10-10",
    "completion_status": "In Progress",
    "last_updated": "2026-08-15",
    "source_rung": 5,
    "work_description": "Construction of community hall at Ward 9",
    "activity_name": "Construction of buildings for community activities",
    "recommendation_date": null,
    "work_stage": "Physical Inspection",
    "completion_date": null,
    "has_public_document": false
  },
  {
    "work_id": "MPLADS-FX-0005",
    "state": "Madhya Pradesh",
    "constituency": "Madhya Pradesh Constituency 7",
    "mp_name": "Rajesh Oraon",
    "tenure": "2024-2029",
    "implementing_district_authority": "Madhya Pradesh District Authority",
    "implementing_agency": "State Electricity Board Civil Wing",
    "vendor_id": "SYNTH-V002",
    "vendor_name": "Ganesh Infra Pvt Ltd",
    "work_category": "Sanitation",
    "sanctioned_amount_inr": 2741938.0,
    "expenditure_amount_inr": 0.0,
    "sanction_date": "2023-02-18",
    "completion_status": "Sanctioned",
    "last_updated": "2026-08-15",
    "source_rung": 5,
    "work_description": null,
    "activity_name": null,
    "recommendation_date": null,
    "work_stage": null,
    "completion_date": null,
    "has_public_document": null
  },
  {
    "work_id": "MPLADS-FX-0006",
    "state": "Rajasthan",
    "constituency": "Rajasthan Constituency 11",
    "mp_name": "Pramod Kumar Tiwari",
    "tenure": "2024-2029",
    "implementing_district_authority": "Rajasthan District Authority",
    "implementing_agency": "Municipal Corporation Works Cell",
    "vendor_id": "SYNTH-V003",
    "vendor_name": "Shree Balaji Construction",
    "work_category": "Road",
    "sanctioned_amount_inr": 2435299.43,
    "expenditure_amount_inr": 1408938.16,
    "sanction_date": "2023-10-15",
    "completion_status": "In Progress",
    "last_updated": "2026-08-15",
    "source_rung": 5,
    "work_description": null,
    "activity_name": null,
    "recommendation_date": null,
    "work_stage": null,
    "completion_date": null,
    "has_public_document": null
  },
  {
    "work_id": "MPLADS-FX-0007",
    "state": "Jharkhand",
    "constituency": "Jharkhand Constituency 3",
    "mp_name": "Vijay Chandra Behera",
    "tenure": "2024-2029",
    "implementing_district_authority": "Jharkhand District Authority",
    "implementing_agency": "PWD Division 7",
    "vendor_id": null,
    "vendor_name": null,
    "work_category": "School",
    "sanctioned_amount_inr": 3597301.49,
    "expenditure_amount_inr": 0.0,
    "sanction_date": "2023-09-16",
    "completion_status": "Sanctioned",
    "last_updated": "2026-08-15",
    "source_rung": 5,
    "work_description": null,
    "activity_name": null,
    "recommendation_date": null,
    "work_stage": null,
    "completion_date": null,
    "has_public_document": null
  },
  {
    "work_id": "MPLADS-FX-0008",
    "state": "Jharkhand",
    "constituency": "Jharkhand Constituency 6",
    "mp_name": "Rajesh Oraon",
    "tenure": "2024-2029",
    "implementing_district_authority": "Jharkhand District Authority",
    "implementing_agency": "Zilla Parishad Works Dept",
    "vendor_id": "SYNTH-V004",
    "vendor_name": "Om Builders",
    "work_category": "Electricity",
    "sanctioned_amount_inr": 700123.56,
    "expenditure_amount_inr": 0.0,
    "sanction_date": "2023-03-16",
    "completion_status": "In Progress",
    "last_updated": "2026-08-15",
    "source_rung": 5,
    "work_description": null,
    "activity_name": null,
    "recommendation_date": null,
    "work_stage": null,
    "completion_date": null,
    "has_public_document": null
  },
  {
    "work_id": "MPLADS-FX-0009",
    "state": "Uttar Pradesh",
    "constituency": "Uttar Pradesh Constituency 11",
    "mp_name": "Rajesh Oraon",
    "tenure": "2024-2029",
    "implementing_district_authority": "Uttar Pradesh District Authority",
    "implementing_agency": "State Electricity Board Civil Wing",
    "vendor_id": "SYNTH-V003",
    "vendor_name": "Shree Balaji Construction",
    "work_category": "Road",
    "sanctioned_amount_inr": 2749406.36,
    "expenditure_amount_inr": 2441280.47,
    "sanction_date": "2023-12-12",
    "completion_status": "In Progress",
    "last_updated": "2026-08-15",
    "source_rung": 5,
    "work_description": null,
    "activity_name": null,
    "recommendation_date": null,
    "work_stage": null,
    "completion_date": null,
    "has_public_document": null
  },
  {
    "work_id": "MPLADS-FX-0010",
    "state": "Madhya Pradesh",
    "constituency": "Madhya Pradesh Constituency 16",
    "mp_name": "Rekha Devi Mahato",
    "tenure": "2024-2029",
    "implementing_district_authority": "Madhya Pradesh District Authority",
    "implementing_agency": "Municipal Corporation Works Cell",
    "vendor_id": null,
    "vendor_name": null,
    "work_category": "Health",
    "sanctioned_amount_inr": 3843867.9,
    "expenditure_amount_inr": 3652493.19,
    "sanction_date": "2023-01-24",
    "completion_status": "In Progress",
    "last_updated": "2026-08-15",
    "source_rung": 5,
    "work_description": null,
    "activity_name": null,
    "recommendation_date": null,
    "work_stage": null,
    "completion_date": null,
    "has_public_document": null
  },
  {
    "work_id": "MPLADS-FX-0011",
    "state": "Rajasthan",
    "constituency": "Rajasthan Constituency 13",
    "mp_name": "Rajesh Oraon",
    "tenure": "2024-2029",
    "implementing_district_authority": "Rajasthan District Authority",
    "implementing_agency": "State Electricity Board Civil Wing",
    "vendor_id": "SYNTH-V005",
    "vendor_name": "Bharat Nirman Enterprises",
    "work_category": "School",
    "sanctioned_amount_inr": 3769891.63,
    "expenditure_amount_inr": 1342594.05,
    "sanction_date": "2023-01-15",
    "completion_status": "Completed",
    "last_updated": "2026-08-15",
    "source_rung": 5,
    "work_description": null,
    "activity_name": null,
    "recommendation_date": null,
    "work_stage": null,
    "completion_date": null,
    "has_public_document": null
  },
  {
    "work_id": "MPLADS-FX-0012",
    "state": "Jharkhand",
    "constituency": "Jharkhand Constituency 8",
    "mp_name": "Sunita Mishra",
    "tenure": "2024-2029",
    "implementing_district_authority": "Jharkhand District Authority",
    "implementing_agency": "Municipal Corporation Works Cell",
    "vendor_id": "SYNTH-V003",
    "vendor_name": "Shree Balaji Construction",
    "work_category": "Drinking Water",
    "sanctioned_amount_inr": 1294651.88,
    "expenditure_amount_inr": 464377.04,
    "sanction_date": "2023-07-28",
    "completion_status": "In Progress",
    "last_updated": "2026-08-15",
    "source_rung": 5,
    "work_description": null,
    "activity_name": null,
    "recommendation_date": null,
    "work_stage": null,
    "completion_date": null,
    "has_public_document": null
  },
  {